{"name":"virtual_dispatch_candidates","category":"relationships","sources":["src/main.cpp"],"expect":{"relationships":[{"source":"invoke","kind":"Calls","target":"Base::draw","resolution":"Exact","dispatch":"Virtual"},{"source":"invoke","kind":"Calls","target":"Derived::draw","resolution":"Conservative","dispatch":"Virtual"}]}}
