{"name":"expression_access","category":"relationships","sources":["src/main.cpp"],"expect":{"relationships":[{"source":"exercise","kind":"Reads","target":"state","count":2},{"source":"exercise","kind":"Writes","target":"state","count":2},{"source":"exercise","kind":"TakesAddress","target":"callback"},{"source":"exercise","kind":"Calls","target":"callback","resolution":"Conservative","dispatch":"Dynamic"}]}}
