{"name":"alias_and_canonical_type","category":"types","sources":["src/main.cpp"],"expect":{"symbols":[{"qualified_name":"Index","kind":"TypeAlias","count":1},{"qualified_name":"index_value","kind":"Variable","type_kind":"Named","canonical_type":"unsigned long"},{"qualified_name":"raw_value","kind":"Variable","type_kind":"Builtin","canonical_type":"unsigned long"}],"type_equivalences":[{"left":"index_value","right":"raw_value"}]}}
