{"name":"direct_call","category":"relationships","sources":["src/main.cpp"],"expect":{"symbols":[{"qualified_name":"target","kind":"Function","definitions":1},{"qualified_name":"caller","kind":"Function","definitions":1}],"relationships":[{"source":"caller","kind":"Calls","target":"target","resolution":"Exact","dispatch":"Static"}],"absent_relationships":[{"source":"target","kind":"Calls","target":"caller"}]}}
