{"name":"explicit_specialization","category":"templates","sources":["src/main.cpp"],"expect":{"symbols":[{"qualified_name":"Value","kind":"ClassTemplate","count":1},{"qualified_name":"Value","kind":"Struct","count":1}],"relationships":[{"source":"Value","kind":"Specializes","target":"Value","count":1}]}}
